1;2022-02-15;None;Привет;Всем привет!
2;2022-02-20;2022-02-25;Солнышко светило;На небе солнышно светило, и день был прекрасен!
3;2022-03-05;None;Весна;Весна пришла, весне дорогу!
4;2022-05-10;2023-05-12;Ни о чём;Ещё одна заметка...
5;2022-07-12;None;Рыбка;У самого синего моря жила-была рыбка...
6;2022-08-05;None;Море;У самого синего моря!
7;2023-05-12;None;Лукоморье;У Лукоморья дуб зеленый, златая цепь на дубе том. И днём и ночью кот учёный всё ходит по цепи кругом.
8;2023-05-12;2023-05-12;Вечерело;Вечерело и темнело...
